{
  "github": {
    "username": "mwguerra",
    "trackRepos": ["*"],
    "excludeRepos": [],
    "trackIssues": true,
    "trackPRs": true,
    "trackReviews": true,
    "cacheMinutes": 15
  },
  "briefing": {
    "showOnStart": true,
    "includeGitHub": true,
    "includePendingCommitments": true,
    "includeRecentDecisions": true,
    "includeGoalProgress": true,
    "includePatterns": false,
    "daysBack": 7
  },
  "logging": {
    "captureCommits": true,
    "captureDecisions": true,
    "captureCommitments": true,
    "captureToolCalls": false
  },
  "vault": {
    "enabled": true,
    "syncOnSessionEnd": true,
    "workflowFolder": "workflow"
  },
  "patterns": {
    "enabled": true,
    "minConfidence": 0.6,
    "minEvidence": 3
  }
}
